<?xml version="1.0" encoding="UTF-8"?>
<coatOfArms xmlns="http://github.com/wlievens/heraldry" xmlns:xsi="http://www.w3.org/2001/XMLSchema-instance"
            xsi:schemaLocation="http://github.com/wlievens/heraldry ../src/main/resources/xsd/heraldry.xsd">
    <shape>heater-shield</shape>
    <background>
        <field tincture="gules"/>
    </background>
    <charges>
        <mobile figure="fleur-de-lis" tincture="or"/>
        <ordinary type="bordure">
            <background>
                <variation type="barry" firstTincture="argent" secondTincture="sable" number="10"/>
            </background>
        </ordinary>
    </charges>
</coatOfArms>
