<?xml version="1.0" encoding="UTF-8"?>
<coatOfArms xmlns="http://github.com/wlievens/heraldry" xmlns:xsi="http://www.w3.org/2001/XMLSchema-instance"
            xsi:schemaLocation="http://github.com/wlievens/heraldry ../src/main/resources/xsd/heraldry.xsd">
    <title>William de Fokeram</title>
    <blazon>Or, a bend indented azure</blazon>
    <shape>vertical-banner</shape>
    <background>
        <field tincture="or"/>
    </background>
    <charges>
        <ordinary type="bend" tincture="azure" line="indented"/>
    </charges>
</coatOfArms>