<?xml version="1.0" encoding="UTF-8"?>
<coatOfArms xmlns="http://github.com/wlievens/heraldry" xmlns:xsi="http://www.w3.org/2001/XMLSchema-instance"
            xsi:schemaLocation="http://github.com/wlievens/heraldry ../src/main/resources/xsd/heraldry.xsd">
    <shape>heater-shield</shape>
    <background>
        <division type="quarterly">
            <part position="1,3">
                <background>
                    <field tincture="or"/>
                </background>
            </part>
            <part position="2,4">
                <background>
                    <field tincture="argent"/>
                </background>
            </part>
        </division>
    </background>
    <charges>
        <ordinary type="fret" tincture="gules"/>
    </charges>
</coatOfArms>
